{"projectId":"11111111-1111-4111-8111-111111111111","generationMode":"range","target":{"startChapterNo":2,"endChapterNo":3,"requestedChapterCount":2},"sourceWorkflowRunId":"22222222-2222-4222-8222-222222222222","candidates":[{"chapterNo":4,"title":"越界候选","summary":"摘要","chapterPurpose":"plot_advance","storylineRefs":[{"id":"33333333-3333-4333-8333-333333333333","projectId":"11111111-1111-4111-8111-111111111111","label":"主线","relation":"primary","position":0,"version":1}],"materialRefs":[],"foreshadowingRefs":[],"generationBasis":{"contextSummary":"安全上下文","additionalInstructions":null}},{"chapterNo":3,"title":"第二候选","summary":"摘要","chapterPurpose":"conflict_escalation","storylineRefs":[{"id":"33333333-3333-4333-8333-333333333333","projectId":"11111111-1111-4111-8111-111111111111","label":"主线","relation":"primary","position":0,"version":1}],"materialRefs":[],"foreshadowingRefs":[],"generationBasis":{"contextSummary":"安全上下文","additionalInstructions":null}}],"metadata":{"inputDigest":"aaaaaaaaaaaaaaaaaaaaaaaaaaaaaaaaaaaaaaaaaaaaaaaaaaaaaaaaaaaaaaaa","generatedAt":"2026-07-24T00:00:00Z","safeProviderSummary":"normalized"}}
